Fecha,Hora_del_llamado,Hora_de_primera_respuesta,Tipo_de_emergencias,Dirección,1cia,2cia,3cia,4cia,Detalle_unidades,Situación,Hora_de_término_de_la_emergencia,Tiempo_respuesta,Tiempo_en_controlar_emergencia,Periodo,Emergencias_cod_corto
2020-09-21,21:47:00,21:55:00,10.1,"Bellavista, Holanda, altura departamente N. 1073",0,1,0,0,,"Incendio de motor de vehiculo, controlado por propietario",22:12:00,8.0,17.0,2020-09,10.1
2020-09-23,03:40:00,03:47:00,10.5.1,Avenida la playa N. 172,1,0,1,0,,"Caida de aceite tipo industrial en patio de casa, controlado",04:21:00,7.0,34.0,2020-09,10.5
2020-09-24,07:50:00,08:25:00,10.12 X  10.3.2,El Quisco,0,1,0,0,,Busqueda de persona en roquerios y acantilado,12:52:00,35.0,267.0,2020-09,10.3
2020-09-24,18:10:00,18:18:00,10.4.1,"Ruta nuevo acceso, frente a Puerto Columbo",1,0,1,0,,Colision de motorista con vehiculo menor,18:37:00,8.0,19.0,2020-09,10.4
2020-09-24,22:47:00,22:51:00,10.2.1,Orella con Esperidion Vera,1,0,0,0,,Quema de pasto y basura,23:11:00,4.0,20.0,2020-09,10.2
2020-09-25,14:37:00,14:42:00,Segunda alarma de incendio,"Centenario, farmacia Cruz Verde",1,1,1,1,,Incendio en bodegas segundo piso farmacia Cruz Verde.,15:11:00,5.0,29.0,2020-09,10.0
2020-09-26,04:00:00,04:05:00,10.4.1,"Puente Arevalo, Villa El Sol",1,1,0,0,,Choque vehiculo menor contra barrera de contencion ,04:54:00,5.0,49.0,2020-09,10.4
2020-09-26,11:50:00,11:57:00,10.6.1,"Salvador Allende, block N. 1161",1,0,1,0,,"Posible emanacion de gas en departamentos, controlado, se dejan recomendaciones",12:44:00,7.0,47.0,2020-09,10.6
2020-09-28,13:00:00,13:09:00,10.3.1,"Ignacio Cerda N. 386, Bellavista",0,1,0,0,,Ave atrapada en arbol,13:40:00,9.0,31.0,2020-09,10.3
2020-09-28,17:55:00,18:09:00,10.3.1,"Seno Relocavi N. 1281, con Armando Pino",0,1,0,0,,Gato atrapado en entre-techo,18:34:00,14.0,25.0,2020-09,10.3
2020-09-28,20:44:00,20:49:00,10.6.1,Pasaje Pompeya con Palermo,1,0,1,0,,Fuga de GLP de cilindro de 15 kilos,21:29:00,5.0,40.0,2020-09,10.6
2020-09-29,10:23:00,10:28:00,10.2.1,Orella,1,0,0,0,,Quema de colchon en via publica,10:33:00,5.0,5.0,2020-09,10.2
2020-09-29,16:25:00,16:28:00,10.3.1,Mall Arauco San Antonio,0,1,0,0,,Adulto mayor cae desde escalera mecanica,16:46:00,3.0,18.0,2020-09,10.3
2020-09-29,19:10:00,19:19:00,10.2.1,"Puente Llollito, frente a cancha Huracan",0,0,1,0,,"Quema pastizal frente a cancha Huracan, no hay acceso",19:19:00,9.0,0.0,2020-09,10.2
2020-09-30,22:36:00,22:43:00,10.2.1,Arrayan con los maquis,0,0,1,0,,"Quema en sitio particular, sin peligro de propagacion ",23:02:00,7.0,19.0,2020-09,10.2
2022-04-01,07:28:00,07:44:00,10.6.1,"Ignacio Cerda con Sargento Aldea, Bellavista",0,0,1,0,B-3,Olor desconocido en el ambiente,08:08:00,16.0,24.0,2022-04,10.6
2022-04-01,12:38:00,12:42:00,10.4.1,Avenida Barros Luco con Curico,1,1,0,0,RX-1/B-2,Colision de baja energia de dos vehiculos particulares,13:03:00,4.0,21.0,2022-04,10.4
2022-04-02,03:19:00,03:24:00,10.8,"Gabriela Mistral, poblacion Juan Aspee",1,0,1,0,B-1/B-3,Quema de neumaticos,04:50:00,5.0,86.0,2022-04,10.8
2022-04-02,11:30:00,11:34:00,10.2.1,"Bernando Ohiggins, poblacion Juan Aspee",0,0,1,0,B-3,"Quema de pasto, basura, neumaticos",11:52:00,4.0,18.0,2022-04,10.2
2022-04-02,12:25:00,12:29:00,10.2.1,Calle Aromos,0,0,1,0,B-3,Quema de pequeña extension de pasto,12:47:00,4.0,18.0,2022-04,10.2
2022-04-03,05:14:00,05:19:00,10.1,"Rotonda, poblacion Juan Aspee",0,0,1,0,B-3,Fuego en rampla de camion,05:47:00,5.0,28.0,2022-04,10.1
2022-04-03,11:41:00,11:48:00,10.4.1,"Rosedal, Tejas verdes",1,0,0,1,RX-1/B-4,Colision de 2 vehiculos particulares,12:04:00,7.0,16.0,2022-04,10.4
2022-04-03,18:06:00,18:15:00,10.2.1,"San Antonio de las bodegas, a una cuadra de Holanda",1,0,0,0,B-1,Quema de pequeña extension de pasto,18:40:00,9.0,25.0,2022-04,10.2
2022-04-03,21:40:00,21:47:00,10.7,"Irene Frei, avenida la playa S/N",0,0,1,0,B-3,Problema electrico en empalme de casa habitacion,22:18:00,7.0,31.0,2022-04,10.7
2022-04-04,07:37:00,07:48:00,10.4.1,"Avenida Chile, altura de Construmart",1,0,0,0,RX-1,Caida de motorista,08:01:00,11.0,13.0,2022-04,10.4
2022-04-04,18:09:00,18:19:00,10.2.1,viscachas con torcazas N. 680,0,0,1,0,B-3,Quema de pequeños focos de pasto en patio de casa,18:30:00,10.0,11.0,2022-04,10.2
2022-04-04,18:50:00,19:01:00,10.6.1,Los demarcadores N.1933 con Linderos,0,0,1,0,B-3,Problema en regulador de cilindro de gas,19:29:00,11.0,28.0,2022-04,10.6
2022-04-04,19:32:00,19:40:00,10.2.1,Calle Aromos,0,0,1,0,B-3,Quema de pequeña extension de pasto,19:46:00,8.0,6.0,2022-04,10.2
2022-04-04,19:46:00,19:49:00,10.4.1,Balmaceda con Hermanos Carrera,1,1,0,0,RX-1/B-2,Colision de dos vehiculos,19:58:00,3.0,9.0,2022-04,10.4
2022-04-05,00:44:00,00:50:00,10.6.2,"Colombas del mar, Baquedano",0,0,1,1,B-3/B-4,Falla en sistema central en coneccion desde el primer a cuarto piso,01:23:00,6.0,33.0,2022-04,10.6
2022-04-05,13:36:00,13:47:00,10.4.3,Cruce de Cartagena,1,0,1,0,RX-1/R-1/B-3,Volcamiento de camion,13:54:00,11.0,7.0,2022-04,10.4
2022-04-05,14:01:00,14:03:00,10.4.3,Cruce de Cartagena,1,0,1,0,RX-1/B-3,Colision de camion,14:17:00,2.0,14.0,2022-04,10.4
2022-04-05,16:57:00,17:02:00,10.6.2,"El sauce N. 960, con Rafael de la presa",0,0,1,1,B-3//BX-4,Fuga de GLP desde calefont,17:40:00,5.0,38.0,2022-04,10.6
2022-04-05,19:16:00,20:14:00,10.2.1,Camino del agua,0,0,0,1,BX-4,"Quema de pasto, matorrales en quebrada",21:15:00,58.0,61.0,2022-04,10.2
2022-04-05,20:47:00,20:54:00,10.7,"San Antonio de las bodegas, S/N",0,1,0,0,B-2,Fuego en cables de tendido electrico,21:08:00,7.0,14.0,2022-04,10.7
2022-04-05,22:17:00,22:20:00,10.0,El molo con Avenida Barros Luco,1,1,0,0,B-1/B-2,Incendio en local comercial,22:32:00,3.0,12.0,2022-04,10.0
2022-04-06,08:27:00,08:32:00,10.4.2,Carabineros de Chile con Angamos,1,0,1,0,RX-1/B-3,Colision de vehiculo particular con taxi colectivo,08:57:00,5.0,25.0,2022-04,10.4
2022-04-06,19:33:00,19:48:00,10.2.1,"Camino el alto, San Juan",0,0,0,1,BX-4,Quema de pasto y basura,20:17:00,15.0,29.0,2022-04,10.2
2022-04-07,09:39:00,09:45:00,10.5,"Manuel Montt 1138, villa primavera",0,0,1,0,B-3,Rotura de termometro,09:59:00,6.0,14.0,2022-04,10.5
2022-04-07,12:34:00,12:44:00,10.8,Florencia con Isla mocha S/N,0,1,0,0,B-2,Quema de basura y madera en parrilla,13:04:00,10.0,20.0,2022-04,10.8
2022-04-07,12:50:00,12:57:00,10.4.1,Avenida Providencia N. 57,1,0,1,0,RX-1/B-3,Vehiculo particular se incrusto en local comercial,12:57:00,7.0,0.0,2022-04,10.4
2022-04-08,08:36:00,08:49:00,10.0,"Alto el roble, cerro la virgen",1,0,1,0,B-1/B-3,"Incendio estructural, fase libre combustion",09:47:00,13.0,58.0,2022-04,10.0
2022-04-08,10:10:00,10:24:00,10.6.2,Los claveles con flor del inca S/N,0,1,1,0,B-2/B-3,Fuga de gas desde cilindro de 11 kilos,11:11:00,14.0,47.0,2022-04,10.6
2022-04-08,17:51:00,17:56:00,10.4.1,Acceso al puerto,1,0,1,0,RX-1/B-3,Volcamiento de vehiculo menor,18:11:00,5.0,15.0,2022-04,10.4
2022-04-08,14:38:00,14:44:00,10.4.1,1 Norte con Sanfuentes,1,1,0,0,RX-1/B-2,Colision de vehiculos menores,15:03:00,6.0,19.0,2022-04,10.4
2022-04-08,16:46:00,16:52:00,10.8,Libertad N. 466,1,0,0,0,B-1,Principio de incendio en ampliacion de baño,17:14:00,6.0,22.0,2022-04,10.8
2022-04-11,10:26:00,10:31:00,10.3.1,"Orella, block 17",0,1,0,0,Q-2,Apoyo a SAMU,10:50:00,5.0,19.0,2022-04,10.3
2022-04-11,21:06:00,21:11:00,10.6.1,"Ignacio Cerda N. 2954, poblacion Barros Luco",0,0,1,0,B-3,Acumulacion de GLP por mala manipulacion de cilindro de 11 kilos,21:29:00,5.0,18.0,2022-04,10.6
2022-04-12,00:06:00,00:11:00,10.0,"Avenida Providencia, costado farmacia Salco",0,0,1,0,B-1/B-3,Incendio en local comercial,00:56:00,5.0,45.0,2022-04,10.0
2022-04-13,10:30:00,10:37:00,10.6.2,Serrano N. 450,1,1,0,0,B-1/B-2,Emanacion de gas,10:59:00,7.0,22.0,2022-04,10.6
2022-04-13,12:15:00,12:20:00,10.4.1,Antonio Nuñez de Fonseca S/N,1,1,0,0,RX-1/B-2,"Choque por persecucion, 1 fallecido",12:46:00,5.0,26.0,2022-04,10.4
2022-04-13,19:16:00,19:31:00,10.2.1,Cruce Cuncumen,0,0,1,0,B-3,Quema pastizal,20:17:00,15.0,46.0,2022-04,10.2
2022-04-14,19:42:00,20:03:00,10.2.2,Costado de vertedero clandestino,0,0,1,0,BT-3,Fuego en basural clandestino,22:54:00,21.0,171.0,2022-04,10.2
2022-04-15,01:10:00,01:16:00,10.12X10.0,Rocas de Santo Domingo,0,0,1,1,B-3/BX-4,Apoyo a CB de Santo Domingo,03:29:00,6.0,133.0,2022-04,10.0
2022-04-15,01:49:00,01:54:00,10.1,San Pedro N. 2055,1,1,0,0,B-1/B-2,"Quema de neumaticos en patio de domicilio, afecta camion con contenedor",03:11:00,5.0,77.0,2022-04,10.1
2022-04-15,17:06:00,17:14:00,10.8,"Maule S/N, Barrancas",1,0,0,0,B-1,"Quema de pasto, 50 metros cuadrados",17:55:00,8.0,41.0,2022-04,10.8
2022-04-15,17:52:00,18:00:00,10.4.1,"Ruta 78, kilometro 105",1,1,0,0,RX-1/B-2,Desbarrancamiento de vehiculo menor,18:11:00,8.0,11.0,2022-04,10.4
2022-04-16,00:54:00,01:25:00,10.2.1,"Los molles, Aguas buenas",1,1,0,0,B-1/B-2,"Quema de basura, 30 metros cuadrados aprox",02:59:00,31.0,94.0,2022-04,10.2
2022-04-16,01:03:00,01:13:00,10.2.1,"Luis Gonzalez con Jose Maria Caro, 30 de marzo",0,0,1,0,B-3,"Quema de basura, 1 metro cuadrado aprox",01:30:00,10.0,17.0,2022-04,10.2
2022-04-16,22:33:00,22:38:00,10.2.1,Avenida Aromos S/N,0,0,1,0,B-3,Quema de pasto a orillas del camino,22:43:00,5.0,5.0,2022-04,10.2
2022-04-17,11:31:00,11:41:00,10.4.1,"Manuel Bulnes, aguas saladas",1,1,0,0,RX-1/B-2,Colision de dos vehiculos menores,11:50:00,10.0,9.0,2022-04,10.4
2022-04-17,16:18:00,16:27:00,1.8,Avenida Aromos S/N,0,1,0,0,R-2,Persona extraviada,17:20:00,9.0,53.0,2022-04,10.8
2022-04-17,20:00:00,20:13:00,10.7,Raquel Almarza con R. Fernadez S/N,0,1,0,0,B-2,Problemas en tendido electrico,21:09:00,13.0,56.0,2022-04,10.7
2022-04-17,22:18:00,22:19:00,10.2.1,"Lo Gallardo, poblacion santa Rosa",0,0,0,1,BX-4,Quema de pasto y basura,23:49:00,1.0,90.0,2022-04,10.2
2022-04-18,17:42:00,17:50:00,10.1,"Pasaje norte, Cerro alegre",0,1,0,0,B-2,Incendio al interior de vehiculo menor,18:00:00,8.0,10.0,2022-04,10.1
2022-04-18,18:06:00,18:19:00,10.2.1,final de pasaje Copiapo,1,0,0,0,B-1,"Quema de pasto, pequeña extension",18:23:00,13.0,4.0,2022-04,10.2
2022-04-18,18:59:00,19:04:00,10.2.1,Villa el sol,0,1,0,0,B-2,Quema de basura en patio de domicilio particular,19:56:00,5.0,52.0,2022-04,10.2
2022-04-19,11:33:00,11:39:00,10.4.3,Acceso al puerto,1,0,1,0,R-1/RX-1/B-3,Choque de camion contra ladera de cerro,11:58:00,6.0,19.0,2022-04,10.4
2022-04-19,16:23:00,16:36:00,10.3.1,Manuel Montt S/N,0,1,0,0,Q-2,Persona atenta contra su vida,17:33:00,13.0,57.0,2022-04,10.3
2022-04-19,18:25:00,18:30:00,10.0,Puertecito,1,1,0,0,B-1/B-2,"Fumigacion en local comercial, falsa alarma",18:41:00,5.0,11.0,2022-04,10.0
2022-04-19,23:45:00,23:51:00,10.2.1,San Antonio de las bodegas,0,1,0,0,B-2,Barricada,23:57:00,6.0,6.0,2022-04,10.2
2022-04-20,02:35:00,02:40:00,10.2.1,"Calle Angamos, atrás de ACHS",1,0,0,0,B-1,Fuego en sitio eriazo,03:00:00,5.0,20.0,2022-04,10.2
2022-04-22,11:49:00,11:59:00,10.6.1,Pasaje forestal N. 771,0,0,1,0,B-3,Acumulacion de GLP en cocina de casa habitacion,12:26:00,10.0,27.0,2022-04,10.6
2022-04-22,23:30:00,23:35:00,10.2.1,Puente Arevalo,0,1,0,0,B-2,Quema de pasto y basura,23:38:00,5.0,3.0,2022-04,10.2
2022-04-23,11:42:00,11:50:00,10.2.1,pasaje Arturo Pratt con Enriqueta S/N,1,0,0,0,B-1,Quema de pasto y basura,12:24:00,8.0,34.0,2022-04,10.2
2022-04-23,12:50:00,12:55:00,10.6.1,Avenida Centenario N.23,1,0,0,0,B-1,"Olor a gas, controlado",13:31:00,5.0,36.0,2022-04,10.6
2022-04-23,18:29:00,18:38:00,10.8,Orella con las palmeras,1,0,0,0,B-1,Quema de basura en patio de domicilio particular,18:43:00,9.0,5.0,2022-04,10.8
2022-04-24,14:59:00,15:02:00,10.0,Lanalhue N. 545,0,1,1,0,B-2/B-3,Fuego en casa habitacion,15:04:00,3.0,2.0,2022-04,10.0
2022-04-24,19:42:00,19:46:00,10.7,Los claveles pasaje los girasoles,0,0,1,0,B-3,"Fuego en cruzeta, mediana tension",20:19:00,4.0,33.0,2022-04,10.7
2022-04-24,20:32:00,20:38:00,10.8,Lanalhue N. 545,0,0,1,0,B-3,Rebrote incendio anterior,21:03:00,6.0,25.0,2022-04,10.8
2022-04-24,23:47:00,23:58:00,10.0,Pasaje Pehuen N: 2489 las dunas,1,0,0,0,B-1,Fuego en mejora de casa,00:22:00,11.0,24.0,2022-04,10.0
2022-04-25,08:34:00,08:39:00,10.4.1,"4 sur, barrancas",1,1,0,0,RX-1/B-2,Colision de vehiculo menor,08:53:00,5.0,14.0,2022-04,10.4
2022-04-25,15:20:00,15:22:00,10.1,Avenida San Juan N. 4760,0,0,0,1,BX-4,Incendio de camioneta,15:48:00,2.0,26.0,2022-04,10.1
2022-04-25,20:07:00,20:13:00,10.4.1,Maule con Manuel Montt,1,1,0,0,RX-1/B-2,Caida de motorista,20:29:00,6.0,16.0,2022-04,10.4
2022-04-25,22:05:00,22:14:00,10.2.1,Calle central costado cancha Juan Aspee,0,0,1,0,B-3,Quema de pastizal y basura,23:00:00,9.0,46.0,2022-04,10.2
2022-04-26,03:13:00,03:20:00,10.0,Camino antiguo a Santiago,1,1,0,0,B-2/B-3,Incendio de mejora por moradores,03:46:00,7.0,26.0,2022-04,10.0
2022-04-26,06:37:00,06:42:00,10.7,"Pasaje Pedro Santander, las lomas",0,0,1,0,B-3,Falsa alarma,06:53:00,5.0,11.0,2022-04,10.7
2022-04-27,00:32:00,00:50:00,10.7,Mauricio Mena N. 55,0,1,0,0,B-2,Corte en tendido electrico al interior de recinto domiciliario,01:32:00,18.0,42.0,2022-04,10.7
2022-04-27,10:12:00,10:20:00,10.6.2,"El sauce N. 960, con Rafael de la presa",0,0,1,1,B-3/BX-4,Presumible fuga de GLP,10:46:00,8.0,26.0,2022-04,10.6
2022-04-27,15:32:00,15:41:00,10.8,"Nelson Roumual, block 14, depto 1434 cumbres de miramar",0,1,0,0,Q-2,"Cocina encendida, controlado",15:47:00,9.0,6.0,2022-04,10.8
2022-04-28,18:06:00,18:16:00,10.8,Los olmos N. 2025,0,0,1,0,B-3,Caida de motorista,18:35:00,10.0,19.0,2022-04,10.8
2022-04-29,20:10:00,20:14:00,10.4.1,Puertecito,0,1,0,0,B-2,"Accidente de transito, activa airbag produciendo emanacion de gas",20:31:00,4.0,17.0,2022-04,10.4
2022-04-30,10:39:00,10:45:00,10.0,Delfines con Aromos,0,1,0,0,B-2,Quema de basura,10:59:00,6.0,14.0,2022-04,10.0
2022-04-30,13:10:00,13:16:00,10.4.1,Olegario Henriquez S/N,1,0,1,0,RX-1/B-3,Vehiculo volcado,13:21:00,6.0,5.0,2022-04,10.4
2022-04-30,17:03:00,17:06:00,10.4.1,Angamos S/N,1,1,0,0,RX-1/B-2,Colision de tren con camioneta,17:22:00,3.0,16.0,2022-04,10.4
2021-05-01,11:27:00,11:29:00,10.8,Centenario N. 102,0,1,0,0,,"Activacion de dispositivo de seguridad anto robo, se descarta fuente calorica",12:31:00,2.0,62.0,2021-05,10.8
2021-05-02,18:58:00,19:02:00,10.4.1,Plaza de San Antonio,1,1,0,0,,Colision de motorista con vehiculo particular,19:17:00,4.0,15.0,2021-05,10.4
2021-05-02,19:34:00,19:41:00,10.0,"Calle atardecer N. 548, Bellavista",1,1,0,0,,Recalentamiento de olla sobre cocina encendida,20:43:00,7.0,62.0,2021-05,10.0
2021-05-03,21:21:00,21:29:00,10.7,"Luis Hinojosa N. 1427, con Ignacio Carrera Pinto",1,0,0,0,,Fuego en poste que conecta con casa habitacio,21:57:00,8.0,28.0,2021-05,10.7
2021-05-04,13:05:00,13:24:00,10.2.1,Condomini Viñas de Santo Domingo,0,0,0,1,,"Quema de pastizal, 100 metros cuadrados aprox",13:48:00,19.0,24.0,2021-05,10.2
2021-05-04,18:43:00,18:55:00,10.4.3,Nuevo acceso a Barros Luco,1,0,1,0,,Colision de dos camiones,19:29:00,12.0,34.0,2021-05,10.4
2021-05-05,17:39:00,17:45:00,10.6.1,Jacson N. 1713 con los laureles,0,0,1,0,,Liberacion de GLP desde cilindro de 5 kilos,18:09:00,6.0,24.0,2021-05,10.6
2021-05-05,23:14:00,23:25:00,10.2.1,Parque DYR,0,0,1,0,,Quema de pastizal y basura,23:42:00,11.0,17.0,2021-05,10.2
2021-05-06,11:17:00,11:23:00,10.4.1,Avenida Barros Luco,1,0,1,0,,Colision de dos vehiculos menores,11:35:00,6.0,12.0,2021-05,10.4
2021-05-06,11:48:00,11:55:00,10.4.2,San Antonio de las bodegas,1,0,1,0,,Colision de dos taxi colectivos,12:23:00,7.0,28.0,2021-05,10.4
2021-05-06,17:05:00,17:30:00,10.4.3,"Paso sepultura, autopista del sol",1,0,1,0,,Colision de dos camiones,17:41:00,25.0,11.0,2021-05,10.4
2021-05-06,19:09:00,19:19:00,10.6.2,San Antonio de las bodegas,0,1,1,0,,Liberacion de GLP desde cilindro de 45 kilos,20:08:00,10.0,49.0,2021-05,10.6
2021-05-07,07:33:00,07:43:00,10.2.1,San Antonio de las bodegas,0,1,0,0,,"Quema de basura y material combustible, 50 metros cuadrados aprox",07:58:00,10.0,15.0,2021-05,10.2
2021-05-08,13:09:00,13:13:00,10.2.1,Palmieri N. 485,1,1,0,0,,Quema de pasto y basura,13:18:00,4.0,5.0,2021-05,10.2
2021-05-08,22:37:00,22:42:00,10.7,Maule con Manuel Montt,1,0,0,0,,Fuego en foco de poste de alumbrado publico,22:54:00,5.0,12.0,2021-05,10.7
2021-05-11,13:59:00,14:01:00,10.4.1,Samuel Garcia con Domingo Fernandez Concha,1,1,0,0,,Colision de dos vehiculos menores,14:38:00,2.0,37.0,2021-05,10.4
2021-05-11,06:22:00,06:26:00,10.4.1,Antonio Nuñez de Fonseca,1,1,0,0,,Choque de vehiculo menor contra poste,06:57:00,4.0,31.0,2021-05,10.4
2021-05-11,06:28:00,06:45:00,10.6.1,"Ines Balmaceda del Rio N. 421, nueva bruselas",0,0,1,0,,Liberacion de GLP desde cilindro de 11 kilos,07:26:00,17.0,41.0,2021-05,10.6
2021-05-11,14:07:00,14:10:00,10.4.1,Balmaceda,1,1,0,0,,Choque de taxi colectivo,14:32:00,3.0,22.0,2021-05,10.4
2021-05-12,22:16:00,22:19:00,10.4.1,Antonio Nuñez de Fonseca,1,1,0,0,,"Choque de vehiculo menor, pierde el control",22:32:00,3.0,13.0,2021-05,10.4
2021-05-13,21:12:00,21:17:00,10.4.2,"Julio Letelier, Ginebra",1,0,1,0,,Colision de dos vehiculos menores,21:44:00,5.0,27.0,2021-05,10.4
2021-05-14,11:10:00,11:21:00,10.4.2,San Antonio de las bodegas,1,0,1,0,,Colision de taxi colectivo contra vehiculo particular,11:49:00,11.0,28.0,2021-05,10.4
2021-05-14,12:45:00,13:03:00,10.2.1,"Camino a Leyda, kilometro 17",0,0,0,1,,Incendio de arbol por problema electrico,13:46:00,18.0,43.0,2021-05,10.2
2021-05-14,15:03:00,15:11:00,10.4.1,Cruce de Cartagena,1,1,0,0,,Colision de vehiculo particular con motorista,15:24:00,8.0,13.0,2021-05,10.4
2021-05-17,18:48:00,18:50:00,10.4.1,Avenida Barros Luco con El Molo,1,1,0,0,,Colision de dos vehiculos menores,19:00:00,2.0,10.0,2021-05,10.4
2021-05-17,20:23:00,20:29:00,10.3.1,Arrayan N. 823,0,1,0,0,,Menor atrapado en reja al interior del domicilio,20:41:00,6.0,12.0,2021-05,10.3
2021-05-17,22:30:00,22:40:00,10.0,Sargento Aldea N. 446,0,1,0,0,,Principio de incendio en entretecho de casa habitacion,23:21:00,10.0,41.0,2021-05,10.0
2021-05-18,12:23:00,12:36:00,10.2.1,Carmen Guerrero cerca iglesia mormona en Villa Italia,1,1,0,0,,Quema de basura al interior de patio de casa habitacion,12:40:00,13.0,4.0,2021-05,10.2
2021-05-18,16:05:00,16:12:00,10.6.2,Vicente Poblete N. 3012,1,0,1,0,,Acumulacion de basura al interior de patio de jardin infantil,16:45:00,7.0,33.0,2021-05,10.6
2021-05-19,07:54:00,08:03:00,10.4.3,Autopista nuevo acceso,1,0,1,0,,"Colision vehiculo menor contra vehiculo mayor, un fallecido",08:30:00,9.0,27.0,2021-05,10.4
2021-05-20,10:17:00,10:30:00,10.4.3,Autopista nuevo acceso,1,0,1,0,,Desbarrancamiento vehiculo mayor,11:17:00,13.0,47.0,2021-05,10.4
2021-05-20,10:32:00,10:40:00,10.0,"Las araucanias, toma camino antiguo a Cartagena",0,1,0,0,,Incendio en casa habitacion,11:45:00,8.0,65.0,2021-05,10.0
2021-05-20,16:24:00,16:43:00,10.2.1,Parque DYR,0,0,0,1,,Quema de pastizal y basura,17:09:00,19.0,26.0,2021-05,10.2
2021-05-20,19:23:00,19:28:00,10.4.2,"Jose Miguel Carrera s/n, cristo rey",1,0,1,0,,Colision de dos vehiculos menores,19:28:00,5.0,0.0,2021-05,10.4
2021-05-21,10:41:00,10:49:00,10.1,Las gualtecas N. 866,1,0,0,0,,Fuego en motor de vehiculo,11:32:00,8.0,43.0,2021-05,10.1
2021-05-21,13:34:00,13:41:00,10.1,"Villa Genesis, calle Julio Nuñez Alvarez, block 6",0,1,0,0,,Fuego en vehiculo particular,14:30:00,7.0,49.0,2021-05,10.1
2021-05-22,18:59:00,19:02:00,10.4.1,"Antonio Nuñez de Fonseca, frente a puerto Panul",1,1,0,0,,Choque de vehiculo menor,19:10:00,3.0,8.0,2021-05,10.4
2021-05-22,23:11:00,23:13:00,10.4.1,"Avenida Barros Luco, frente al estadio municipal",1,0,1,0,,Colision de dos vehiculos particulares,23:37:00,2.0,24.0,2021-05,10.4
2021-05-23,13:33:00,13:36:00,10.5,"Avenida Barros Luco, servicentro Shell",0,0,1,0,,Derrame de combustible desde vehiculo menor,13:46:00,3.0,10.0,2021-05,10.5
2021-05-23,18:56:00,19:21:00,10.2.1,Camino a Cartagena,0,1,0,0,,Quema de basura en recinto privado,19:39:00,25.0,18.0,2021-05,10.2
2021-05-24,14:13:00,14:16:00,10.4.1,"Balmaceda, Hermanos Carrera",0,1,0,0,,Colision de vehiculo menor con motorista,14:42:00,3.0,26.0,2021-05,10.4
2021-05-25,22:26:00,22:56:00,10.2.1,"Autopista del sol, pasado Sepultura",0,0,0,1,,Inflamacion en animita,23:07:00,30.0,11.0,2021-05,10.2
2021-05-26,11:09:00,11:16:00,10.3.1,Puente Arevalo,0,1,0,0,,Perro empantanado en estero,12:31:00,7.0,75.0,2021-05,10.3
2021-05-26,12:51:00,12:54:00,10.4.1,Avenida Barros Luco con Mario Martinez,1,1,0,0,,Colision de dos vehiculos menores,13:16:00,3.0,22.0,2021-05,10.4
2021-05-26,17:14:00,17:21:00,10.4.2,"Sector Cementerio, laguna",1,0,1,0,,Colision de vehiculo particular con taxi colectivo,18:00:00,7.0,39.0,2021-05,10.4
2021-05-26,19:02:00,19:08:00,10.4.1,Rotonda de Curico,1,0,1,0,,Colision de dos vehiculos menores,19:25:00,6.0,17.0,2021-05,10.4
2021-05-26,19:43:00,19:51:00,10.4.1,"Antonio Nuñez de Fonseca, frente a puerto Panul",1,1,0,0,,Vehiculo choca contra poste,19:59:00,8.0,8.0,2021-05,10.4
2021-05-27,20:08:00,20:17:00,10.2.1,Calle central,1,0,0,0,,Quema de pastizal y basura,21:19:00,9.0,62.0,2021-05,10.2
2021-05-28,20:47:00,20:58:00,10.3.1,Lautaro con Luis Reuss,0,1,0,0,,Cae porton sobre trabajador (sodimac),21:09:00,11.0,11.0,2021-05,10.3
2021-05-28,21:59:00,22:06:00,10.4.2,Avenida Chile con Baquedano,1,0,1,0,,Colision de vehiculos menores,22:16:00,7.0,10.0,2021-05,10.4
2021-05-29,03:50:00,03:59:00,10.1,"Las industrias, San Juan",0,0,0,1,,Fuego en dos camiones,05:44:00,9.0,105.0,2021-05,10.1
2021-05-29,18:42:00,18:52:00,10.0,San Antonio de las bodegas,1,1,0,0,,Incendio estructural,19:42:00,10.0,50.0,2021-05,10.0
2021-05-30,01:07:00,01:17:00,10.0,San Antonio de las bodegas,0,1,0,0,,Fuego en vivienda,02:21:00,10.0,64.0,2021-05,10.0
2021-05-31,12:34:00,12:43:00,10.0,Manuel Bulnes,1,1,0,0,,Incendio compartimental,13:02:00,9.0,19.0,2021-05,10.0
2022-05-01,16:33:00,16:37:00,10.6.2,Luis Reuss N. 184,1,0,0,0,B-1,Liberacion de GLP desde cilindro de 45 kilos,16:44:00,4.0,7.0,2022-05,10.6
2022-05-01,17:52:00,18:05:00,10.12X10.0,"Calle bulnes, Villa Cartago",1,1,0,0,B-1/B-2,"Apoyo a CB de Cartagena, incendio casa",18:29:00,13.0,24.0,2022-05,10.0
2022-05-02,08:53:00,09:00:00,10.3.1,"21 de mayo, Homecenter",0,1,0,0,R-2,Persona atrapada en ascensor,09:40:00,7.0,40.0,2022-05,10.3
2022-05-02,16:50:00,16:56:00,10.2.1,"Santa Rosa, cerro arena",1,0,0,0,B-1,Quema de basura,17:14:00,6.0,18.0,2022-05,10.2
2022-05-03,10:00:00,10:05:00,10.0,Baquedano S/N,0,0,1,1,B-3/BX-4,Fuego en cocina de local comercial,10:38:00,5.0,33.0,2022-05,10.0
2022-05-03,15:33:00,,10.4.1,"Avenida San Juan, calle larga",1,0,0,1,RX-1/BX-4,"Colision vehiculos menores, unidades se devuelven, no es necesario presencia de bomberos",15:42:00,,,2022-05,10.4
2022-05-03,21:09:00,21:19:00,10.3.1,Avenida Barros Luco,1,1,0,0,B-1/R-2,Rescate de persona desde alcantarillado,22:10:00,10.0,51.0,2022-05,10.3
2022-05-04,15:36:00,15:48:00,10.6.1,Cruce de Cartagena,0,0,1,0,B-3,Fuga de mercaptano desde estanque,16:36:00,12.0,48.0,2022-05,10.6
2022-05-05,18:13:00,18:18:00,10.0,Asturias esquina Arturo Pratt,0,1,0,0,B-2,Problema en tendido electrico,18:56:00,5.0,38.0,2022-05,10.0
2022-05-05,14:17:00,14:23:00,10.2.1,Paradero 11 con Avenida Barros Luco,0,0,1,0,B-3,Quema de basura,14:43:00,6.0,20.0,2022-05,10.2
2022-05-05,22:58:00,23:04:00,10.6.2,Lucia Subercaseux,1,0,1,0,B-1/B-3,Fuga de GLP desde cilindro de 45 kilos,23:25:00,6.0,21.0,2022-05,10.6
2022-05-06,23:12:00,23:20:00,10.0,Ginebra con Jose Maldonado S/N,0,0,1,0,B-3,Incendio de casa de material ligero,00:01:00,8.0,41.0,2022-05,10.0
2022-05-09,11:28:00,11:31:00,10.4.1,Avenida Chile con Ginebra,1,0,1,0,RX-1/B-3,Choque de vehiculo particular contra poste,12:00:00,3.0,29.0,2022-05,10.4
2022-05-09,12:33:00,12:40:00,10.4.1,"Del canelo, cristo rey",1,0,1,0,RX-1/B-3,Colision de dos vehiculos particulares,13:05:00,7.0,25.0,2022-05,10.4
2022-05-09,21:15:00,21:24:00,10.2.1,Las vertientes,0,1,0,0,B-2,Quema de basura,21:26:00,9.0,2.0,2022-05,10.2
2022-05-10,18:18:00,18:23:00,10.4.1,Luis Gonzalez con los pinos,1,1,0,0,RX-1/B-2,"Volcamiento de vehiculo, dos lesionados",18:39:00,5.0,16.0,2022-05,10.4
2022-05-10,20:17:00,20:21:00,10.5,"Vertedero ilegal, Bellavista",0,1,0,0,B-2,Fuego en vertedero clandestino,21:22:00,4.0,61.0,2022-05,10.5
2022-05-12,08:25:00,08:31:00,10.1,Miraflores con Portales,0,1,0,0,B-2,Fuego en motor del vehiculo,08:50:00,6.0,19.0,2022-05,10.1
2022-05-12,10:53:00,10:55:00,10.4.1,"Angamos, terminal de buses",1,1,0,0,RX-1/B-2,Colision de dos vehiculos menores,11:10:00,2.0,15.0,2022-05,10.4
2022-05-12,15:11:00,15:21:00,10.3.1,Los mapuches N. 2606,0,1,0,0,Q-2,Menor atrapado en reja,15:40:00,10.0,19.0,2022-05,10.3
2022-05-13,00:19:00,00:27:00,10.0,Manuel Montt con Libertad,1,1,0,0,B-1/B-2,Incendio de casa habitacion,01:18:00,8.0,51.0,2022-05,10.0
2022-05-13,05:35:00,05:39:00,10.2.1,"Vertedero ilegal, Bellavista",0,1,0,0,B-2,Quema de pastizal y basura,07:53:00,4.0,134.0,2022-05,10.2
2022-05-13,10:15:00,10:20:00,10.2.1,"Avenida Angamos, frente a Agunsa",1,0,0,0,B-1,Quema de basura,10:44:00,5.0,24.0,2022-05,10.2
2022-05-13,13:24:00,13:31:00,10.4.1,Rotonda en Curico,1,0,1,0,RX-1/B-3,"Colision multiple, tres vehiculos",13:47:00,7.0,16.0,2022-05,10.4
2022-05-14,09:24:00,09:40:00,10.3.1,Rotonda en STI,0,1,0,0,R-2/Q-2,Trabajador cae a pozo de 3 metros aprox.,10:38:00,16.0,58.0,2022-05,10.3
2022-05-14,21:03:00,21:42:00,10.12X10.0,San Enrique,0,0,1,0,B-3,"Incendio estrucutral, apoyo al CB de Santo Domingo",23:00:00,39.0,78.0,2022-05,10.0
2022-05-16,08:03:00,08:08:00,10.0,Independencia con Orella,1,1,0,0,B-1/B-2,Incendio de cuarto aledaño a casa habitacion,09:00:00,5.0,52.0,2022-05,10.0
2022-05-16,22:14:00,22:30:00,10.4.1,"Autopista del sol, kilometro 94",1,1,0,0,RX-1/B-2,Caida de motorista,23:04:00,16.0,34.0,2022-05,10.4
2022-05-19,12:10:00,12:18:00,10.2.1,Flor Mora Maldonado S/N,1,0,1,0,RX-1/B-3,Quema de pastizal y basura,12:29:00,8.0,11.0,2022-05,10.2
2022-05-19,13:11:00,13:19:00,10.12X10.0,"12 de febrero, Cartagena",1,1,0,0,B-1/B-2,"Incendio de casa habitacion de dos pisos, apoyo a CB de Cartagena",13:19:00,8.0,0.0,2022-05,10.0
